,Unnamed: 0,Item,Profile
361,361,SUB Vapetasia Milk of the Poppy,The exact flavor profile may vary from person to person as perception of taste can be subjective
362,362,DISP Nicless Stick + Disposable 0% NICOTINE FREE - Lush Ice,none
363,363,SUB Air Factory Tobacco,"Tobacco, Nutty, Sweet, Woody"
364,364,SALT Cuttwood Sugar Drizzle,"Salt, Sweet"
365,365,SUB 7 Daze Iced Fusion Orange Yuzu Tangerine Iced,"Orange, Yuzu, Tangerine"
366,366,SALT ML Fruit Monster Mixed Berry,"Raspberry, Blueberry, Strawberry, Blackberry"
367,367,SALT Propaganda Cookie Butter,"Sweet, Salted, Buttery"
368,368,SUB Sadboy Mango Blood Ice,none
369,369,SUB Cloud Chemist Frosty Science Strawberry,Strawberry
370,370,SUB Fruitia Sweet Peach,"Peach, Sweet"
371,371,DISP Elf Bar AIRO MAX 5000 Puffs Banana Pineapple,"Banana, Pineapple"
372,372,SUB Beard Vape Co. Apple Cinnamon The One,"Apple, Cinnamon"
373,373,SALT ML The Milk Jax,"Milk, Salt"
374,374,SALT Cuttwood Unicorn Milk,"Sweet, Creamy, Vanilla, Milk, Custard"
375,375,SUB 7daze Glacial Mint,Mint
376,376,SUB 7 Daze Fusion Watermelon Apple Pear,"Watermelon, Apple, Pear"
377,377,SUB Country Clouds Corn Bread Puddin',"The term ""Country Clouds"" is not recognized as a specific product or brand, so I assumed it was not relevant to the flavor profile description"
378,378,SUB Pachamama Mint Leaf SYN,Mint
379,379,SUB VGod Apple Bomb,"Apple, Sweet, Tart, Crisp"
380,380,SALT Noms X2 Cactus Jackfruit Mandarine,This is based on the assumption that SALT Noms X2 Cactus Jackfruit Mandarine refers to a food or beverage product and each mentioned component contributes distinctly
381,381,SUB 7daze Reds Apple Watermelon,"Apple, Watermelon"
382,382,SALT Juice Head Freeze Blueberry Lemon,"sweet, tart, rich
Lemon"
383,383,DISP EBCreate BC5000 9. 5000 Puffs 650mAh 4% Strawberry Banana,"Strawberry, Banana"
384,384,DISP EBCreate BC5000 Disposable 0% () - Watermelon Ice,"Watermelon, Ice"
385,385,SALT ML Frozen Fruit Monster Blueberry Raspberry Lemon Ice,"Blueberry, Raspberry, Lemon, Ice, Salt, Monster, Frozen, Fruit - Tart, Sweet, Sour, Salty"
386,386,DISP EBCreate BC5000 Disposable 0% () - Rinbo Cloud,none
387,387,DISP Lost Mary OS5000 5000 Puffs 5% Strawberry Mango,"Strawberry, Mango"
388,388,SALT Mighty Vapors Frozen Hulk Tears,none
389,389,SUB Cloud Nurdz Grape Apple,"Grape, Apple"
390,390,SALT Naked 100 Hawaiian POG,"Pineapple, Orange, Guava, Sweet"
391,391,SALT Cloud Chemist The Alchemist,none
392,392,SALT 7 Daze Reds Iced Apple Watermelon Iced,"Apple, Watermelon, Iced, Salt, Reds"
393,393,DISP UWell Caliburn Bar B6000 5% Dragon Fruit Berry,"Dragon Fruit, Berry"
394,394,DISP Airis NEO P8000 5% - Pina Colada Ice,"Coconut, Pineapple, Sweet"
395,395,DISP Airis NEO P8000 5% - Watermelon Bubble Gum,"Watermelon, Bubble Gum"
396,396,SALT Cassadega Cannoli Be Mine,"Sweet, Ricotta, Cassis, Vanilla"
397,397,SUB 7 Daze Fusion Pineapple Coconut Banana,"Pineapple, Coconut, Banana"
398,398,SUB Nomenon Watanomenon,none
399,399,SUB Noms Blunomenom Ice,"Flower, Sweet, Refreshing"
400,400,SALT Pachamama Apple Tobacco,"Apple, Salt, Tobacco"
401,401,SUB Free Noms Caramel Butterscotch Classic,"Caramel, Butterscotch, Classic"
402,402,SUB Twist Tobacco Gold No. 1,Tobacco
403,403,SALT Naked 100 Max Apple Ice,"Apple, Ice, Sweet, Slightly tart, Naked"
404,404,SALT VGod Iced Apple Bomb,"Apple, Sweet, Slightly Tart"
405,405,SALT Juice Head R Blueberry Lemon,"Blueberry, Lemon, Salt, Raspberry"
406,406,SALT Naked 100 Mint Menthol,"Mint, Menthol, Cool"
407,407,SUB Kaleidoscopic Sunrise / Sunset,none
408,408,SALT Verdict Vapors Convict - Strawberry Milk,"Sweet, Strawberry, Milky, Creamy"
409,409,SUB Verdict Vapors Warden - Hazelnut Pecan Butter,"Hazelnut, Pecan, Butter"
410,410,SUB Beard Vape Co. Strawberry The One,"Strawberry, Sweet"
411,411,SALT Vapetasia Milk of the Poppy,"Milk, Poppy, Sweet, Creamy"
412,412,SALT Dinner Lady Lemon Tart,"Lemon, Tart, Sweet, Sour, Citrus"
413,413,DISP Lost Mary MO5000 5000 Puffs 5% Blue Trio,"Based on the product name ""Blue Trio"" and assuming that ""Blue"" refers to a flavor, I assumed the other two flavors in the trio to be Mint and Sweet based on common vape flavors"
414,414,SALT 7 Daze Reds Apple Fruit Mix,"Apple, Fruit, Sweet, Slightly Tart, SALT"
415,415,SALT Candy King Peachy Rings,"Peach, Sweet, Fruity, Sugar, Salt"
416,416,DISP Lost Mary MO5000 5000 Puffs 5% Triple Berry Ice,"Berry, Ice, Triple, Fruity"
417,417,SUB Cuttwood Unicorn Milk,"Creamy, Sweet, Vanilla"
418,418,DISP Nicless Stick + Disposable 0% NICOTINE FREE - Clear,none
419,419,SALT 7 Daze Fusion Yellow Green Red Mango,"Mango, Sweet, Tangy"
420,420,SUB 7 Daze Fusion Yellow Green Red Mango,"Mango, Yellow, Green, Red"
421,421,SUB Dinner Lady Lemon Tart,"Lemon, Tart, Citrus"
422,422,SALT 7 Daze Reds Apple Gold Kiwi Iced,"Apple, Reds, Kiwi, Iced, Salt"
423,423,SUB MRKT PLCE Fuji Pear Mangoberry,"Pear, Mangoberry"
424,424,DISP Tyson 2.0 Heavy Weight 7000 Puffs - Frozen Blueberry,Blueberry
425,425,DISP EB Design BC5000 9. 5000 Puffs 650mAh 4% Cranberry Punch,"Cranberry, Punch"
426,426,SALT Glas Basix Blueberry Cake,"Blueberry, Cake, Sweet"
427,427,SALT Cassadega Cannoli Be Graham,"Sweet, Graham, Cassis"
428,428,DISP EBCreate BC5000 0% () - Blue Razz Ice,"Blue Razz, Ice"
429,429,SUB ML Frozen Fruit Monster Strawberry Banana Ice,"Strawberry, Banana"
430,430,DISP Nicless Next 0% NICOTINE FREE - Blue Razz Lemonade,"Blue Razz, Lemonade"
431,431,DISP Nicless Stick + Disposable 0% NICOTINE FREE - Menthol,Menthol
432,432,SALT Innevape Carousel,Salt
433,433,SUB Cloud Nurdz Blue Raspberry Lemon,none
434,434,SUB ML Lemonade Monster Mint Lemonade,"Lemonade, Mint"
435,435,SALT Skwezed Iced Peach Ice,"Peach, Sweet, Iced, Slightly Salty"
436,436,SALT Pod Juice Cola Freeze,none
437,437,SUB 7 Daze Iced Fusion Kiwi Passionfruit Guava Iced,"Kiwi, Passionfruit, Guava"
438,438,SUB Cloud Chemist Claws,none
439,439,SALT 7 Daze Fusion Lemon Passionfruit Blueberry,"Lemon, Passionfruit, Blueberry, Salt"
440,440,SUB Noms X2 White Peach Raspberry,"Peach, Raspberry"
441,441,SALT Cuttwood Bird Brains,none
442,442,SUB ML Lemonade Monster Strawberry Lemonade,"Lemonade, Strawberry"
443,443,SUB Chubby Vapes Purp,"Purple, Sweet, Fruity"
444,444,SUB 7daze Glacial Mint 100m,"Mint, Glacial"
445,445,SALT Candy King Worms,"Sweet, Salt, Caramel, Chocolate"
446,446,SALT ML Lemonade Monster Strawberry Lemonade,"Sodium, Lemon, Lemonade, Monster, Strawberry, Sweet"
447,447,SALT Pachamama Blue Razz Ice,"Blue Razz, Sweet, Raspberry, Ice, Mint, Cool"
448,448,SALT VGod Summer Strawberry,"Strawberry, Sweet, Slightly tart"
449,449,SUB Bad Drip Cereal Trip,none
450,450,DISP EBCreate BC5000 9. 5000 Puffs 650mAh 4% Lemon Mint,"Lemon, Mint"
451,451,SALT Cloud Chemist Pebble Science,none
452,452,SALT Kaleidoscopic Clouds Optical Illusion,none
453,453,DISP Elf Bar BC5000 9. 5000 Puffs 650mAh 5% Rainbow Candy,"Sweet, Sour, Tangy, Rainbow, Candy"
454,454,SALT 7 Daze Glacial Mint,"Mint, Cool, Refreshing, Tingling, Ice, Minty"
455,455,SALT VGod Iced Mango Bomb,"Mango, Sweet, Slightly Tart"
456,456,SUB Candy King Batch 100 ML,"Sweet, Fruity, Apple, Caramel"
457,457,SUB Pinup Vapors Beach Betty,"Coconut, Pineapple, Vanilla"
458,458,DISP Tyson 2.0 Heavy Weight 7000 Puffs - Melon Head,Melon
459,459,SUB Gost Vapor The Pancake House Blueberry,Blueberry
460,460,SUB Gost Vapor The Pancake House Golden Maple,"Maple, Pancake, Sweet"
461,461,DISP Airis NEO P8000 5% - Blueberry Ice,"Blueberry, Ice, Sweet"
462,462,SUB ML Jam Monster Banana,Banana
463,463,SALT Fruitia Apple Kiwi,"Apple, Kiwi, Salt"
464,464,SUB Suicide Bunny Sucker Punch,This is based on the common flavor descriptions for Suicide Bunny Sucker Punch e-liquid
465,465,SALT Pod Juice Strawberry Banana,"Strawberry, Banana, Salt"
466,466,SUB 7daze Reds Apple Gold Kiwi Iced,"Apple, Kiwi, Reds, Iced"
467,467,SUB Beard Vape Co. #00 006,"Tobacco, Sweet, Woody"
468,468,DISP Lost Mary MO5000 5000 Puffs 5% Raspberry Lemonade,"Raspberry, Lemonade"
469,469,SALT Glas Basix Brown Tobacco,Tobacco
470,470,DISP Lost Vape Orion Bar 5% 7500 Puffs - Dragon Fruit Berry,"Dragon Fruit, Berry"
471,471,SUB Fruitia Jus Blue Raspberry Cotton Candy,"Sweet, Fruity"
472,472,SUB Steam Co. Gentleman's Reserve,"Tobacco, Sweet, Smooth, Nutty"
473,473,DISP Lost Mary OS5000 5000 Puffs 5% Pineapple Mango,"Pineapple, Mango"
474,474,SALT 7 Daze Iced Fusion Strawberry Mango Nectarine Iced,"Strawberry, Mango, Nectarine, Salt"
475,475,SUB Nomenon Watanomenon ICE,"Minty, Refreshing, Cool"
476,476,SALT ML Frozen Fruit Monster Mango Peach Guava Ice,"Sweet, Tangy, Mango, Peach, Guava"
477,477,SUB 7Daze Reds Slapple,"Berry, Sweet, Citrus, Tangy"
478,478,SUB Sadboy Coconut Cake,Coconut
479,479,DISP EBCreate BC5000 9. 5000 Puffs 650mAh 4% Blue Razz Ice,"Blue Razz, Ice"
480,480,SALT 7Daze Slapple,Salt
481,481,SUB Propaganda The Hype Pink and Blue,none
482,482,SALT Naked 100 Max Strawberry Ice,"Strawberry, Ice, Sweet, Fruity"
483,483,DISP Elf Bar BC5000 9. 5000 Puffs 650mAh 5% Passion Fruit Orange Guava,"Passionfruit, Orange, Guava"
484,484,SUB Mighty Vapors Frozen Hulk Tears Frozen Green Apple Straw-Melon Chew,"Apple, Green, Straw-Melon, Frozen, Hulk, Tears, Mighty, Vapors"
485,485,SALT VGod Lush Ice Eliquids,"Ice, Menthol, Sweet, Sour, Blueberry"
486,486,SUB Glas Basix Juicy OFT Sweet & Refreshing,"Juicy, OFT, Sweet, Refreshing"
487,487,SUB Beard Vape Co. Marshmellow The One,"Marshmallow, Sweet"
488,488,DISP EB Design BC5000 9. 5000 Puffs 650mAh 4% Peach Mango Watermelon,"Peach, Mango, Watermelon"
489,489,SALT ML Tobacco Monster Smooth,"The words ""Salt"" and ""ML"" are often used to describe a specific type of vape flavor profile, which is characterized by a strong salty taste and a relatively mild, milky sweetness"
490,490,DISP EBCreate BC5000 9. 5000 Puffs 650mAh 4% Strawberry Kiwi,"Strawberry, Kiwi"
491,491,SALT Pod Juice Aloe Grape Freeze,none
492,492,SUB Juice Head F Pineapple GrapeFruit FREEZE,"The word ""Freeze"" is assumed to indicate a cold or frozen flavor profile"
493,493,SALT Chubby Vapes Strawberry,"Strawberry, Sweet, Fruity"
494,494,SUB ML Jam Monster Raspberry,Raspberry
495,495,SUB Noms 100 Nom Pop,"Sweet, Butter, Popcorn"
496,496,SALT Skwezed R Watermelon,"Watermelon, Sweet, Refreshing"
497,497,SALT VGod Cubano Black,"Tobacco, Sweet, Spicy, Woody"
498,498,SUB Juice Head R Strawberry Kiwi,"Strawberry, Kiwi"
499,499,SALT Pachamama Sorbet,none
500,500,SUB Nomenon Grapenomenon ICE,Grape
501,501,SUB 7 Daze Fusion Strawberry Mango Nectarine,"Strawberry, Mango, Nectarine"
502,502,SUB Pachamama Peach Papaya Coconut,"Peach, Papaya, Coconut"
503,503,DISP Elf Bar BC5000 9. 5000 Puffs 650mAh 5% Strawberry Pina Colada,"Strawberry, Pina Colada"
504,504,DISP Elf Bar AIRO MAX 5000 Puffs Berry Blast,"Berry, Blast"
505,505,DISP Metaku Spongie 7500 Puffs - Cherry Lemon,"Cherry, Lemon"
506,506,SUB Innevape Carousel,"Fruity, Sweet, Apple, Cinnamon"
507,507,DISP Lost Vape Orion Bar Exotic Edition 5% 7500 Puffs - Cafe Mocha,"Coffee, Chocolate"
508,508,SALT 7 Daze Iced Fusion Kiwi Passionfruit Guava Iced,"Kiwi, Passionfruit, Guava, Iced, Salt"
509,509,DISP Cali Boxx 4000 3% Puffs - Blue Raspberry Kiwi Lemonade,"Blue Raspberry, Kiwi, Lemonade"
510,510,SUB Pinup Vapors Betty,"Strawberry, Vanilla, Custard"
511,511,SUB Beard Vape Co. #00 003,"Tobacco, Vanilla, Maple, Woody"
512,512,SALT 7 Daze Reds Iced Apple Original Iced,"Apple, Sweet, Slightly Tart"
513,513,DISP Nicless Stick + Disposable 0% NICOTINE FREE - Pink Lemonade,"Citrus, Sweet, Tangy, Lemonade"
514,514,SUB Noms X2 Cactus Jackfruit Mandarin,"Cactus, Jackfruit, Mandarin"
515,515,SUB Pop Clouds Watermelon,Watermelon
516,516,SUB Vapetasia Killer Kustard Strawberry,The words used here are subjective and may not accurately represent the flavor profile experienced by everyone due to individual taste preferences
517,517,SALT 7 Daze Iced Fusion Pineapple Coconut Banana Iced,"Pineapple, Coconut, Banana, Salt"
518,518,SALT ML Jam Monster Peach,"Sweet, Peach, Salt"
519,519,SUB Yogi Peanut Butter Banana Granola Bar,Sweet
520,520,SUB 7daze Reds Iced Apple Original Iced,Apple
521,521,SALT ML Jam Monster Black Cherry,"Cherry, Sweet, Slightly Tart, Intense"
522,522,SALT Sadboy Happy End Pink,"Savory or umami taste
Sadboy"
523,523,SALT 7 Daze Fusion Pineapple Coconut Banana,"Pineapple, Coconut, Banana, Salt"
524,524,SUB Yogi Strawberry Granola Bar,Strawberry
525,525,SALT Pinup Vapors Betty Chill,"Menthol, Sweet, Berry, Chill"
526,526,DISP Lost Mary MO5000 5000 Puffs 5% Lemon Sparkling Wine,"Lemon, Sparkling, Wine"
527,527,DISP Lost Mary MO5000 5000 Puffs 5% Yummy,Yummy
528,528,SALT Twist Blend No.1,Salt
529,529,DISP Cali Boxx 4000 3% Puffs - Mighty Mint,Mint
530,530,SALT Pachamama Kiwi Berry Ice,"I cannot taste or smell the product myself, so I can only provide the flavors listed in its name as given"
531,531,SUB 7daze Reds Iced Apple Berries Iced,"Apple, Berries"
532,532,SUB Shijin Tortoise Blood on ICE,none
533,533,DISP SnowWolf Compak 7500puff 5% Pacific Cooler,none
534,534,DISP RAZ TN9000 5% Cherry Lemon,"Cherry, Lemon"
535,535,SALT 7 Daze Iced Fusion Strawberry Banana Apple Iced,"Strawberry, Banana, Apple, Sweet"
536,536,SALT 7 Daze Iced Fusion Grape Apple Aloe Iced Iced,"Grape, Apple, Aloe, Iced, Salt, Fusion"
537,537,SALT POD Juice Fruity Bears Freeze,"Fruity, Bear, Freeze, Salt"
538,538,SUB Fruitia Apple Kiwi Ice,"Apple, Kiwi, Ice"
539,539,SALT Twist Green No.1,none
540,540,SUB Bad Drip God Nectar,none
541,541,SALT Shijin Tortoise Blood on ICE,none
542,542,SUB Candy King Swedish,"Berry, Sweet, Licorice, Citrus"
543,543,SUB Glas Basix Strawberry Blast,Strawberry
544,544,SALT 7 Daze Fusion Orange Yuzu Tangerine,"Orange, Yuzu, Tangerine, Salt"
545,545,SALT Beard #32 3250,Salt
546,546,SALT Pod Juice Jewel Mint Diamond,none
547,547,SALT Sadboy C Shamrock Cookie,"Sweet, Salty"
548,548,DISP Geek Bar Pulse 5% Tropical Rainbow Blast,The exact flavor profile may vary from person to person as perception of taste is subjective
549,549,SUB Skwezed Green Apple,"Green Apple, Tart, Sweet"
550,550,SALT ML Fruit Monster Strawberry Banana,"Strawberry, Banana, Sweet, Fruity"
551,551,DISP MINT by MNKE Bars 6500 Puffs 5% Spearmint,"Mint, Spearmint"
552,552,DISP Nicless Stick + Disposable 0% NICOTINE FREE - Cool Mint,"Mint, Cool"
553,553,SALT Sadboy J Lemon Cookie,"Salt, Sadboy, J, Lemon, Cookie"
554,554,SUB Bad Drip Dont Care Bear,none
555,555,SUB ML Jam Monster Black Cherry,Cherry
556,556,SUB Naked 100 Strawberry Pom Menthol,"Strawberry, Pom, Menthol"
557,557,SUB Candy King Cola Gummies 100 ML,Cola
558,558,DISP EBCreate BC5000 9. 5000 Puffs 650mAh 4% Triple Berry Ice,"Triple Berry, Ice"
559,559,SALT Skwezed R Peach,"Peach, Sweet, Slightly Tart, Salt"
560,560,SUB Candy King Worms,"Sugar, Chocolate, Worms"
561,561,DISP Lost Mary MO5000 5000 Puffs 5% Ginger Beer,"Ginger, Sweet, Carbonated, Spicy"
562,562,SUB ML Frozen Fruit Monster Strawberry Lime Ice,"Strawberry, Lime"
563,563,SALT Vapetasia Royalty 2,"Tobacco, Sweet, Rich"
564,564,DISP EBCreate BC5000 9. 5000 Puffs 650mAh 4% Mango Peach,"Mango, Peach"
565,565,DISP Lost Mary OS5000 5000 Puffs 5% Light Snow Peppermint,"Mint, Peppermint"
566,566,SALT Cloud Chemist Frosty Science,"Menthol, Cool, Frosted, Science, Chemistry, Salt"
567,567,SALT VGod Purple Bomb,"Berry, Sweet, Sour, Candy"
568,568,DISP Lost Vape Orion Bar 5% 7500 Puffs - Blueberry Raspberry,"Blueberry, Raspberry"
569,569,SALT Twist Mint No.1,The description provided is based on the product name and does not constitute an official flavor profile
570,570,SALT 7 Daze Fusion Pineapple Mango Orange,"Pineapple, Mango, Orange, Salt"
571,571,SALT Juice Head R Strawberry Kiwi,"Strawberry, Kiwi, SALT, Raspberry"
572,572,SUB Juice Head Freeze Raspberry Lemonade,"Raspberry, Lemonade"
573,573,SUB ML Tobacco Monster Bold,"Tobacco, Bold"
574,574,DISP Tyson 2.0 Heavy Weight 7000 Puffs - Watermelon,Watermelon
575,575,SALT Pinup Vapors Beach Betty,none
576,576,SUB Sadboy Keylime Cookie,none
577,577,DISP Elf Bar BC5000 9. 5000 Puffs 650mAh 5% Cranberry Grape,"Cranberry, Grape"
578,578,DISP Lost Mary MO5000 5000 Puffs 5% Tropical Fruit,"Tropical, Fruit"
579,579,SALT Naked 100 Strawberry Pom Menthol,"Strawberry, Pom, Menthol, Salt"
580,580,SUB Kaleidoscopic Sunset / Sunrise,none
581,581,SUB Naked 100 American Patriot,"Tobacco, Sweet, Caramel, Vanilla"
582,582,SUB Nomenon Grapenomenon,Grape
583,583,DISP Lost Mary OS5000 5000 Puffs 5% Blue Cotton Candy,"Sweet, Blue, Cotton, Candy"
584,584,SUB Twist Pink No. 1,"Raspberry, Sweet"
585,585,DISP Lost Mary OS5000 5000 Puffs 5% Strawberry Pina Colada,"Strawberry, Pina Colada"
586,586,DISP KROS 3 Unlimited 3% 6000 Puffs - Watermelon Bubblegum,"Watermelon, Bubblegum"
587,587,SUB Glas Basix Banana Cream Pie,"Banana, Cream, Pie"
588,588,SUB Juice Head R Orange Mango,"Orange, Mango"
589,589,SUB Yogi Java Granola Bar,"Coffee, Roasted, Sweet, Oat, Honey"
590,590,DISP Lost Vape Orion Bar 5% 7500 Puffs - Passion Fruit Pineapple,"PassionFruit, Pineapple"
591,591,SALT Fruitia Jus Rainbow Ice,"Fruit, Sweet, Rainbow, Ice, Slightly Salty"
592,592,DISP SnowWolf Compak 7500puff 5% Triple Berry Ice,"Berry, Ice, Triple, Fruity"
593,593,SUB Sadboy Happy End Pink Cotton Candy,none
594,594,SUB Candy King Peachy Rings 100 ML,Peach
595,595,SUB Propaganda The Hype America,none
596,596,SUB Fruitia Blood Orange Cactus,"Oranges, Blood, Cactus"
597,597,DISP KROS 3 Unlimited 3% 6000 Puffs - Vanilla Wafer,"Vanilla, Wafer"
598,598,SALT Keep it 100 OG Pink,Salt
599,599,SALT Fruitia Passion Fruit Guava,"Tart, Sweet, Fruity, Passionfruit, Guava"
600,600,DISP RAZ CA6000 5% Watermelon Ice,"Watermelon, Ice"
601,601,DISP Lost Mary MO5000 5000 Puffs 5% Mango Peach,"Mango, Peach"
602,602,DISP Pachamama 3000 Puffs 1200mAh Watermelon Ice,"Watermelon, Ice"
603,603,SALT Juice Head Freeze Guava Peach,"Guava, Peach, Salt, Freeze"
604,604,SALT ML Frozen Fruit Monster Strawberry Banana Ice,"Sweet, Strawberry, Banana, Ice, Salt"
605,605,SALT ML Lemonade Monster Mango Lemonade,"savory or umami, ML"
606,606,SALT Bad Drip God Nectar,The interpretation of the flavor profile is subjective and based on the given input
607,607,DISP Elf Bar BC5000 9. 5000 Puffs 650mAh 5% Strazz,"Strawberry, Five Percent"
608,608,SALT ML Jam Monster Strawberry,"Sweet, Fruity, Strawberry, Jam, Monster, Salt"
609,609,SUB 7 Daze Iced Fusion Pineapple Coconut Banana Iced,"Pineapple, Coconut, Banana"
610,610,SALT Skwezed R Lychee,The description is based on the general flavor profile of lychees and may vary depending on the specific product or brand of Skwezed R Lychee
611,611,SALT Noms Watanomenon,none
612,612,SUB Vapetasia Royalty 2,"Tobacco, Vanilla, Sweet, Rich"
613,613,DISP RAZ CA6000 5% Strawberry Kiwi,"Strawberry, Kiwi"
614,614,SALT 7 Daze Reds Iced Apple Strawberry Iced,"Apple, Strawberry, Iced, Salt, Reds"
615,615,SALT ML Frozen Fruit Monster Banana Ice,"The words ""Sweet"" and ""Ice"" may not be necessary as they are common descriptors for most frozen fruit desserts, but including them for clarity"
616,616,SALT 7 Daze Iced Fusion Strawberry Blackberry Lemon Iced,"Strawberry, Blackberry, Lemon, Salt"
617,617,SALT Pachamama Honeydew Melon,"Melon, Honeydew, Sweet, Slightly tart, Subtle, Smooth, Mellow, Slightly salty"
618,618,SALT Cloud Chemist Heisenberry Crunch,"Heisenberry is a trademarked name for a raspberry-black currant hybrid, so the flavor profile might also include notes of Raspberry and Black Currant"
619,619,SALT Sadboy F Rainbow Blood,none
620,620,SUB Air Factory Unflavored,none
621,621,SUB VGod Lucious,"Vanilla, Creamy"
622,622,SALT Glas Basix Banana Cream Pie,"Banana, Cream, Sweet, Slightly Tart, Vanilla"
623,623,SUB Cloud Chemist The Alchemist,none
624,624,SALT Sadboy C Key Lime Cookie,"Salt, Key Lime"
625,625,DISP Lost Mary OS5000 5000 Puffs 5% Triple Berry Duo Ice,"Berry, Triple, Ice, Five Percent"
626,626,SUB Khali Devil's Punchbowl ICE,"Spicy, Fruity, Cooling"
627,627,SUB Juice Head R Pineapple Guava,"Pineapple, Guava"
628,628,SALT Propaganda Illuminati,none
629,629,DISP Cali Boxx 4000 5% Puffs - Blue Raspberry Kiwi Lemonade,"Blue Raspberry, Kiwi, Lemonade"
630,630,SUB Twist White No. 1,"Mint, Cooling, Refreshing"
631,631,SALT Air Factory Bold Tobacco,"Tobacco, Bold, Salt, Air"
632,632,DISP E.B Design BC5000 Disposable 0% () - Strawberry Mango,"Strawberry, Mango"
633,633,DISP Lost Mary OS5000 5000 Puffs 5% Strawberry Ice,"Strawberry, Ice"
634,634,SALT Glas Basix Cool Melon,"Melon, Cool"
635,635,SUB Nomenon Lemonomenon,Lemon
636,636,SALT Sadboy C Blueberry Cookie,"Blueberry,Cookie,Salt,Sadboy,C"
637,637,SALT Propaganda Wild Fire,"Spicy, Salt, Heat"
638,638,SUB ML Frozen Fruit Monster Mixed Berry Ice,"Raspberry, Blueberry, Strawberry, Blackberry"
639,639,DISP Lost Mary MO5000 5000 Puffs 4% Banana Raspberry Ice,"Banana, Raspberry, Ice"
640,640,SALT ML Fruit Monster Strawberry Lime,"Strawberry, Lime, Sweet, Sour, Salt"
641,641,DISP Lost Vape Orion Bar 5% 7500 Puffs - Summer Peach Ice,"Peach, Ice, Summer, Sweet, Refreshing"
642,642,SUB Sadboy Unicorn Tears,none
643,643,SUB Candy King Strawberry Watermelon Bubblegum,"Strawberry, Watermelon, Bubblegum"
644,644,SALT Juice Head R Pineapple Grapefruit,"Salt, Head, Pineapple, Grapefruit"
645,645,SUB Alt Zero Excision Harambe,none
646,646,SUB Glas Basix Cool Melon,Melon
647,647,SALT ML Lemonade Monster Blueberry Lemonade,"Citrus, Sweet
Monster"
648,648,SALT Pachamama Purple Mango,"Sweet, Tangy, Mango, Salt"
649,649,SALT Verdict Vapors Warden - Hazelnut Pecan Butter,"Hazelnut, Pecan, Butter"
650,650,SUB Cloud Chemist Frosty Science,"Menthol, Frozen, Sweet, Sour"
651,651,SALT Beard #00 0030,Salt
652,652,DISP RAZ TN9000 5% Graham Twist,none
653,653,SUB Fruitia Passion Fruit Guava,"Passionfruit, Guava"
654,654,SUB Brewed Awakening Classic,"Roasted, Nutty, Malty"
655,655,SALT ML Fruit Monster Strawberry Kiwi Pomegranate,"Strawberry, Kiwi, Pomegranate, Salt, Fruit"
656,656,SALT Sadboy C Custard Cookie,"Salt, C, Custard,Cookie"
657,657,SUB Propaganda Sour Apple,"Sour, Apple"
658,658,SUB Verdict Vapors Mints Chocomint,"Mint, Chocolate, Mint"
659,659,SALT Air Factory Mint,"Mint, Fresh, Cool, Refreshing"
660,660,SUB Noms X2 Kiwi Passionfruit Nectarine,"Kiwi, Passionfruit, Nectarine"
661,661,DISP Metaku Spongie 7500 Puffs - Meta Grape,Grape
662,662,DISP Lost Vape Orion Bar 5% 7500 Puffs - Apple Cotton Candy,"Apple, Cotton Candy"
663,663,SALT Cloud Chemist Cereal Science,"Cereal, Sweet, Milk, Hint-of-Salt"
664,664,SALT Pachamama White Peach Ice,"Peach, Sweet, Ice, Salt"
665,665,SUB Glas Basix Brown Tobacco,Tobacco
666,666,SALT Juice Head R Pineapple Guava,none
667,667,SUB Kaleidoscopic Optical Illusion,none
668,668,SUB Cassadega Cannoli Be Breakfast,none
669,669,SALT Sadboy J Blueberry Jam,"savory, pungent, mineral-like
Sadboy"
670,670,SUB 7daze Reds Apple Gold Kiwi,"Apple, Kiwi, Reds"
671,671,SALT Sadboy Happy End Blue,"Salt, Sadboy, Happy, End, Blue"
672,672,SUB ML The Milk Cinnamon,"Milk, Cinnamon"
673,673,DISP Nicless Next 0% NICOTINE FREE - Raspberry Lemonade,"Raspberry, Lemonade"
674,674,SALT Naked 100 Cuban Blend,"Tobacco, Sweet, Spicy, Woody"
675,675,SALT ML The Milk Cinnamon,"Milk, Cinnamon"
676,676,SUB 7 Daze Iced Fusion Orange Cream Mango Iced,"Orange, Cream, Mango, Fusion"
677,677,SUB 7 Daze Iced Fusion Pineapple Mango Orange Iced,"Pineapple, Mango, Orange"
678,678,SALT Fruitia Strawberry Coconut Refresher,"Sweet, Fruity, Coconutty"
679,679,SUB Propaganda The Hype Juicy Grape,"Grape, Juicy"
680,680,SALT Pod Juice Jewel Mint Ice,"The words ""Salt"" and ""Ice"" describe more of a sensation or experience rather than a distinct flavor"
681,681,SUB Glas Basix Butterscotch Reserve,"Buttery, Sweet, Caramel, Rich"
682,682,DISP KROS 3 Unlimited 5% 6000 Puffs - Spearmint,Spearmint
683,683,DISP KROS 3 Unlimited 5% 6000 Puffs - Vanilla Wafer,"Vanilla, Wafer"
684,684,DISP MINT by MNKE Bars 6500 Puffs 5% Pineapple Mint,"The ""5% Pineapple"" indicates that there is some pineapple flavor present in the product, but it may not be as strong as the mint flavor"
685,685,DISP Lost Mary MO5000 5000 Puffs 5% Watermelon Cherry,"Watermelon, Cherry"
686,686,SALT VGod Mango Bomb,"Mango, Sweet, Intense"
687,687,SUB 7Daze Reds Slapple Iced,"Berry, Sweet, Tart, Refreshing"
688,688,SUB 7 Daze Fusion Strawberry Blackberry Lemon,"Strawberry, Blackberry, Lemon"
689,689,SALT 7 Daze Fusion Banana Cantaloupe Honeydew,"Banana, Cantaloupe, Honeydew, Salt"
690,690,SUB Kaleidoscopic Ruby's Eyes,none
691,691,DISP Elf Bar BC5000 9. 5000 Puffs 650mAh 5% Peach Mango Watermelon,"Peach, Mango, Watermelon"
692,692,SUB Innevape Heisenberg Menthol,"Menthol, Cool"
693,693,SUB Sadboy Strawberry Cheesecake,none
694,694,SALT VGod Lucious,The exact flavor profile may vary from person to person as everyone's taste preferences can be different
695,695,SALT Cloud Chemist Frosty Science Strawberry,Strawberry
696,696,SUB Beard Vape Co. #32,"Tobacco, Maple, Vanilla, Woody"
697,697,SUB Nomenon Lychee Cherry Blossom Raspberry,"Lychee, Cherry Blossom, Raspberry"
698,698,SALT Pinup Vapors Marilyn,"Sweet, Vanilla, Caramel, Cherry"
699,699,SUB Juice Head F Strawberry Kiwi FREEZE,"Strawberry, Kiwi"
700,700,SALT Gost Vapor The Pancake House Strawberry,none
701,701,DISP Tyson 2.0 Heavy Weight 7000 Puffs - Cool Mint,"Mint, Cool"
702,702,DISP Elf Bar AIRO MAX 5000 Puffs Skit Ice,"Mint, Ice"
703,703,DISP Nicless Stick + Disposable 0% NICOTINE FREE - Peach Gummy Bear,"Peach, Gummy, Bear, Sweet"
704,704,DISP RAZ CA6000 5% Miami Mint,Mint
705,705,SUB Alt Zero Excision Paradox OTR,"Vanilla, Caramel, Sweet"
706,706,SUB 7 Daze Iced Fusion Yellow Green Red Mango Iced,"Mango, Yellow, Red, Green"
707,707,SALT Pod Juice Blue Razz Freeze,"Raspberry, Blue, Sweet, Frozen"
708,708,SUB Alt Zero Excision X Rated,"Spicy, Complex, Unique"
709,709,DISP SnowWolf Ease 8000puff Disposable 5% Misc Flavors,none
710,710,DISP Lost Mary MO5000 5000 Puffs 5% Kiwi Fuse,none
711,711,SUB Juice Man Cherry Lime Fizz,"Cherry, Lime, Fizz"
712,712,DISP RAZ TN9000 5% Citronnade,"Citrus, Lemony, Sweet"
